tu_id	speaker	start	end	duration	include	variation	W:normalized_spaces	W:numbers	W:accents	W:non_jefferson	W:pauses_trim	W:prosodic_trim	W:moved_boundaries	W:switches	E:volume	E:pace	E:guess	E:overlap	E:overlap_mismatch	E:overlap_duration	E:unmatched_overlaps	T:shortpauses	T:metalinguistic	T:errors	T:linguistic	original	text	orthographic
720	BO100	4305.158	4307.66	2.502	True	False	0	0	0	0	0	0	0	0	False	False	False	False	False	_	False	0	0	0	6	tra le industrie, tra le imprese,	tra le industrie, tra le imprese,	tra le industrie tra le imprese
721	BO100	4308.035	4312.138	4.103	True	False	0	0	0	0	0	0	0	0	False	False	False	False	False	_	False	0	0	0	12	tra gli autori, e i fan e gli spettatori e i consumatori.	tra gli autori, e i fan e gli spettatori e i consumatori.	tra gli autori e i fan e gli spettatori e i consumatori
722	BO100	4313.586	4319.01	5.424	True	False	0	0	0	0	0	0	0	0	False	False	False	False	False	_	False	0	0	0	14	c' è una dinamica di azione reazione e controreazione, da parte dell' industria culturale.	c' è una dinamica di azione reazione e controreazione, da parte dell' industria culturale.	c' è una dinamica di azione reazione e controreazione da parte dell' industria culturale
723	BO100	4320.29	4323.605	3.315	True	False	0	0	0	0	0	0	0	0	False	False	False	False	False	_	False	0	0	0	11	la logica top down, viene bilanciata da delle spinte bottom up,	la logica top down, viene bilanciata da delle spinte bottom up,	la logica top down viene bilanciata da delle spinte bottom up
724	BO100	4324.478	4326.31	1.832	True	False	0	0	0	0	0	0	0	0	False	False	False	False	False	_	False	0	0	0	5	ma poi magari l' industria,	ma poi magari l' industria,	ma poi magari l' industria
725	BO100	4327.0	4329.415	2.415	True	False	0	0	0	0	0	0	0	0	False	False	False	False	False	_	False	0	0	0	5	riprende in mano. il pallino.	riprende in mano. il pallino.	riprende in mano il pallino
726	BO100	4329.791	4331.648	1.857	True	False	0	0	0	0	0	0	0	0	False	False	False	False	False	_	False	0	0	0	4	di quel determinato contenuto,	di quel determinato contenuto,	di quel determinato contenuto
727	BO100	4332.373	4333.671	1.298	True	False	0	0	0	0	0	0	0	0	False	False	False	False	False	_	False	0	0	0	2	e reagisce.	e reagisce.	e reagisce
728	BO100	4334.071	4342.59	8.519	True	False	0	0	0	0	0	0	0	0	False	False	False	False	False	_	False	1	0	0	24	a quelle che sono state le sollicitazioni (.) ottenure <da parte del pubblico>, da parte delle logiche grass roots, da parte delle produzioni dal basso.	a quelle che sono state le sollicitazioni {P} ottenure <da parte del pubblico>, da parte delle logiche grass roots, da parte delle produzioni dal basso.	a quelle che sono state le sollicitazioni {P} ottenure da parte del pubblico da parte delle logiche grass roots da parte delle produzioni dal basso
729	BO100	4343.371	4345.405	2.034	True	False	0	0	0	0	0	0	0	0	False	False	False	False	False	_	False	0	0	0	6	e reagisce in tanti modi diversi.	e reagisce in tanti modi diversi.	e reagisce in tanti modi diversi
730	BO100	4346.685	4353.546	6.861	True	False	0	0	0	0	0	0	0	0	False	False	False	False	False	_	False	1	0	1, ,	18	per cui (,) ci sono alcuni tipi di properties, che vedono una reazione da parte dell' industria di (.) resistenza.	per cui (,) ci sono alcuni tipi di properties, che vedono una reazione da parte dell' industria di {P} resistenza.	per cui , ci sono alcuni tipi di properties che vedono una reazione da parte dell' industria di {P} resistenza
731	BO100	4354.085	4355.178	1.093	True	False	0	0	0	0	0	0	0	0	False	False	False	False	False	_	False	0	0	0	6	a quello che fanno i fan.	a quello che fanno i fan.	a quello che fanno i fan
732	BO100	4355.776	4356.923	1.147	True	False	0	0	0	0	0	0	0	0	False	False	False	False	False	_	False	0	0	0	3	non è canonico.	non è canonico.	non è canonico
733	BO100	4357.621	4361.038	3.417	True	False	0	0	0	0	0	0	0	0	False	False	False	False	False	_	False	1	0	0	9	non (.) non in~ non mi interessa, non va incluso.	non {P} non in~ non mi interessa, non va incluso.	non {P} non in~ non mi interessa non va incluso
734	BO100	4361.366	4365.873	4.507	True	False	0	0	0	0	0	0	0	0	False	False	False	False	False	_	False	1	0	0	12	la prima reazione (.) di george lucas, e del mondo di star Wars,	la prima reazione {P} di george lucas, e del mondo di star Wars,	la prima reazione {P} di george lucas e del mondo di star wars
735	BO100	4366.088	4370.135	4.047	True	False	0	0	0	0	0	0	0	0	False	False	False	False	False	_	False	1	0	0	7	a (.) e: alle attività, creative dei fan,	a {P} e: alle attività, creative dei fan,	a {P} e alle attività creative dei fan
736	BO100	4370.41	4374.136	3.726	True	False	0	0	0	0	0	0	0	0	False	False	False	False	False	_	False	0	0	0	11	è stata di diniego. voi non potete toccare queste mie properties.	è stata di diniego. voi non potete toccare queste mie properties.	è stata di diniego voi non potete toccare queste mie properties
737	BO100	4374.23	4378.38	4.15	True	False	0	0	0	0	0	0	0	0	False	False	False	False	False	_	False	0	0	0	13	voi non potete toccare questi contenuti che sono oggetto della mia proprietà intellettuale.	voi non potete toccare questi contenuti che sono oggetto della mia proprietà intellettuale.	voi non potete toccare questi contenuti che sono oggetto della mia proprietà intellettuale
738	BO100	4378.973	4384.518	5.545	True	False	0	0	0	0	0	0	0	0	False	False	False	False	False	_	False	1	0	0	18	come cambia il tempo. son passati alcuni anni e l' approccio (.) di star Wars diventato property di disney,	come cambia il tempo. son passati alcuni anni e l' approccio {P} di star Wars diventato property di disney,	come cambia il tempo son passati alcuni anni e l' approccio {P} di star wars diventato property di disney
739	BO100	4384.655	4386.985	2.33	True	False	0	0	0	0	0	0	0	0	False	False	False	False	False	_	False	0	0	0	4	e: è radicalmente diverso.	e: è radicalmente diverso.	e è radicalmente diverso
740	BO100	4387.408	4388.421	1.013	True	False	0	0	0	0	0	0	0	0	False	False	False	False	False	_	False	0	0	0	4	rispetto a queste cose.	rispetto a queste cose.	rispetto a queste cose
741	BO100	4388.504	4393.78	5.276	True	False	0	0	0	0	0	0	0	0	False	False	False	False	False	_	False	1	0	0	17	altri in altri casi d'`e un incoraggiamento, si capisce che (.) quest' azione del pubblico è promozionale.	altri in altri casi d'e un incoraggiamento, si capisce che {P} quest' azione del pubblico è promozionale.	altri in altri casi d' e un incoraggiamento si capisce che {P} quest' azione del pubblico è promozionale
742	BO100	4394.14	4398.383	4.243	True	False	0	0	0	0	0	0	0	0	False	False	False	False	False	_	False	0	0	0	10	funziona, serve ad attirare attenzione, serve ad attirare altri spettatori.	funziona, serve ad attirare attenzione, serve ad attirare altri spettatori.	funziona serve ad attirare attenzione serve ad attirare altri spettatori
743	BO100	4399.118	4401.199	2.081	True	False	0	0	0	0	0	0	0	0	False	False	False	False	False	_	False	0	0	0	7	a volte addirittura si sfrutta il pubblico.	a volte addirittura si sfrutta il pubblico.	a volte addirittura si sfrutta il pubblico
744	BO100	4401.563	4407.588	6.025	True	False	0	0	0	0	0	0	0	0	False	False	False	False	False	_	False	0	0	0	22	e il pubblico trascinato da questa relazione affettiva e dalla voglia di partecipare, non si accorge che sta facendo del lavoro gratis.	e il pubblico trascinato da questa relazione affettiva e dalla voglia di partecipare, non si accorge che sta facendo del lavoro gratis.	e il pubblico trascinato da questa relazione affettiva e dalla voglia di partecipare non si accorge che sta facendo del lavoro gratis
745	BO100	4407.841	4413.62	5.779	True	False	0	0	0	0	0	0	0	0	False	False	False	False	False	_	False	1	0	0	18	per le imprese mediali che nel frattempo gli stanno pure vendendo (.) gli oggettini del merchandise, e così via,	per le imprese mediali che nel frattempo gli stanno pure vendendo {P} gli oggettini del merchandise, e così via,	per le imprese mediali che nel frattempo gli stanno pure vendendo {P} gli oggettini del merchandise e così via
746	BO100	4415.171	4420.05	4.879	True	False	0	0	0	0	0	0	0	0	False	False	False	False	False	_	False	1	0	0	14	di nuovo le dinamiche sono sempre più complesse, se le andiamo a leggere (.) criticamente.	di nuovo le dinamiche sono sempre più complesse, se le andiamo a leggere {P} criticamente.	di nuovo le dinamiche sono sempre più complesse se le andiamo a leggere {P} criticamente
747	BO100	4420.1	4423.28	3.18	True	False	0	0	0	0	0	0	0	0	False	False	False	False	False	_	False	1	0	0	10	jenkins (.) si ferma un po' prima di quest' ultimo aspetto.	jenkins {P} si ferma un po' prima di quest' ultimo aspetto.	jenkins {P} si ferma un po' prima di quest' ultimo aspetto
748	BO100	4423.371	4429.93	6.559	True	False	0	0	0	0	0	0	0	0	False	False	False	False	False	_	False	1	0	0	18	m della (.) dell' industria mediale che riprende in mano le redini e che orienta secondo i suoi, obiettivi.	m della {P} dell' industria mediale che riprende in mano le redini e che orienta secondo i suoi, obiettivi.	m della {P} dell' industria mediale che riprende in mano le redini e che orienta secondo i suoi obiettivi
749	BO100	4430.828	4434.291	3.463	True	False	0	0	0	0	0	0	0	0	False	False	False	False	False	_	False	0	0	0	12	quelle che sono le attività grass roots e le logiche bottom up.	quelle che sono le attività grass roots e le logiche bottom up.	quelle che sono le attività grass roots e le logiche bottom up
750	BO100	4435.658	4442.906	7.248	True	False	0	0	0	0	0	0	0	0	False	False	False	False	False	_	False	0	0	0	18	questo tipo di cultura convergente, è una cultura fatta anche, da rielaborazioni e da ri~=e riappropriazioni continue.	questo tipo di cultura convergente, è una cultura fatta anche, da rielaborazioni e da ri~=e riappropriazioni continue.	questo tipo di cultura convergente è una cultura fatta anche da rielaborazioni e da ri~ e riappropriazioni continue
751	BO100	4444.46	4448.165	3.705	True	False	0	0	0	0	0	0	0	0	False	False	False	False	False	_	False	0	0	0	13	alcuni esempi ve li ho già fatti. altri li vedremo nelle prossime slide.	alcuni esempi ve li ho già fatti. altri li vedremo nelle prossime slide.	alcuni esempi ve li ho già fatti altri li vedremo nelle prossime slide
752	BO100	4448.788	4450.525	1.737	True	False	0	0	0	0	0	0	0	0	False	False	False	False	False	_	False	0	0	0	4	la logica del remix.	la logica del remix.	la logica del remix
753	BO100	4451.233	4452.958	1.725	True	False	0	0	0	0	0	0	0	0	False	False	False	False	False	_	False	0	0	0	4	e quindi del mescolamento.	e quindi del mescolamento.	e quindi del mescolamento
754	BO100	4453.486	4455.156	1.67	True	False	0	0	0	0	0	0	0	0	False	False	False	False	False	_	False	0	0	0	4	le versioni non ufficiali.	le versioni non ufficiali.	le versioni non ufficiali
755	BO100	4455.558	4463.186	7.628	True	False	0	0	0	0	0	0	0	0	False	False	False	False	False	_	False	0	0	0	15	pensate ai:: ai video, ai trailer che vengono fatti cambiando di genere un determinato contenuto.	pensate ai:: ai video, ai trailer che vengono fatti cambiando di genere un determinato contenuto.	pensate ai ai video ai trailer che vengono fatti cambiando di genere un determinato contenuto
756	BO100	4463.515	4465.773	2.258	True	False	0	0	0	0	0	0	0	0	False	False	False	False	False	_	False	0	0	0	8	eh mary poppins che diventa un film horror.	eh mary poppins che diventa un film horror.	eh mary poppins che diventa un film horror
757	BO100	4466.61	4469.973	3.363	True	False	0	0	0	0	0	0	0	0	False	False	False	False	False	_	False	0	0	0	5	e::h pensate agli honest trailer.	e::h pensate agli honest trailer.	eh pensate agli honest trailer
758	BO100	4470.28	4478.37	8.09	True	False	0	0	0	0	0	0	0	0	False	False	False	False	False	_	False	0	0	0	18	<quindi al: fenomeno di prendere dei pezzi>, di un determinato contenuto e prendere in giro bonariamente quel contenuto,	<quindi al: fenomeno di prendere dei pezzi>, di un determinato contenuto e prendere in giro bonariamente quel contenuto,	quindi al fenomeno di prendere dei pezzi di un determinato contenuto e prendere in giro bonariamente quel contenuto
759	BO100	4478.49	4480.88	2.39	True	False	0	0	0	0	0	0	0	0	False	False	False	False	False	_	False	0	0	0	7	riassumendo intere stagioni di games of thrones.	riassumendo intere stagioni di games of thrones.	riassumendo intere stagioni di games of thrones
760	BO100	4481.05	4483.46	2.41	True	False	0	0	0	0	0	0	0	0	False	False	False	False	False	_	False	0	0	0	6	per esempio. cercatelo quello è divertente.	per esempio. cercatelo quello è divertente.	per esempio cercatelo quello è divertente
761	BO100	4483.945	4486.945	3.0	True	False	0	0	0	0	0	0	0	0	False	False	False	False	False	_	False	1	0	0	5	e::h (.) applicandoci uno sguardo ironico.	e::h {P} applicandoci uno sguardo ironico.	eh {P} applicandoci uno sguardo ironico
762	BO100	4487.968	4500.47	12.502	True	False	0	0	0	0	0	0	0	0	False	False	False	False	False	_	False	1	0	0	42	e:h e quindi la chiave di lettura dell' ironia e della satira. qualcuno e:h non mi ricordo (.) chi fra voi, ha:: ha postato, alcune cose sulla sull' ironia come uno dei linguaggi comuni di una: di uno scenario di un estetica digitale.	e:h e quindi la chiave di lettura dell' ironia e della satira. qualcuno e:h non mi ricordo {P} chi fra voi, ha:: ha postato, alcune cose sulla sull' ironia come uno dei linguaggi comuni di una: di uno scenario di un estetica digitale.	eh e quindi la chiave di lettura dell' ironia e della satira qualcuno eh non mi ricordo {P} chi fra voi ha ha postato alcune cose sulla sull' ironia come uno dei linguaggi comuni di una di uno scenario di un estetica digitale
763	BO100	4500.603	4505.698	5.095	True	False	0	0	0	0	0	0	0	0	False	False	False	False	False	_	False	0	0	0	20	e:h fin troppo. che ci è probabilmente scappata di mano e poi ci porta trump come presidente degli stati uniti.	e:h fin troppo. che ci è probabilmente scappata di mano e poi ci porta trump come presidente degli stati uniti.	eh fin troppo che ci è probabilmente scappata di mano e poi ci porta trump come presidente degli stati uniti
764	BO100	4506.031	4509.735	3.704	True	False	0	0	0	0	0	0	0	0	False	False	False	False	False	_	False	1	0	0	9	ma e::h (.) a parte queta piccola parentesi e digressione,	ma e::h {P} a parte queta piccola parentesi e digressione,	ma eh {P} a parte queta piccola parentesi e digressione
765	BO100	4509.975	4513.945	3.97	True	False	0	0	0	0	1	0	0	0	False	False	False	False	False	_	False	0	0	0	12	è: sicuramente un altra, delle leve attraverso le quali si possono leggere (.)	è: sicuramente un altra, delle leve attraverso le quali si possono leggere	è sicuramente un altra delle leve attraverso le quali si possono leggere
766	BO100	4513.945	4519.53	5.585	True	False	0	0	0	0	1	0	0	0	False	False	False	False	False	_	False	0	0	0	13	eh si possono creare, si possono produrre dal basso determinati contenuti che interagiscono (.)	eh si possono creare, si possono produrre dal basso determinati contenuti che interagiscono	eh si possono creare si possono produrre dal basso determinati contenuti che interagiscono
767	BO100	4519.76	4520.91	1.15	True	False	0	0	0	0	0	0	0	0	False	False	False	False	False	_	False	0	0	0	4	con con i media.	con con i media.	con con i media
768	BO100	4520.96	4521.96	1.0	True	False	0	0	0	0	0	0	0	0	False	False	False	False	False	_	False	0	0	0	3	la fan fiction.	la fan fiction.	la fan fiction
769	BO100	4522.07	4524.511	2.441	True	False	0	0	0	0	0	0	0	0	False	False	False	False	False	_	False	0	0	0	8	e quindi lo sviluppo di linee narrative alternative.	e quindi lo sviluppo di linee narrative alternative.	e quindi lo sviluppo di linee narrative alternative
770	BO100	4524.57	4527.52	2.95	True	False	0	0	0	0	0	0	0	0	False	False	False	False	False	_	False	0	0	0	11	una serie è stata chiusa e io ci scrivo altre puntate.	una serie è stata chiusa e io ci scrivo altre puntate.	una serie è stata chiusa e io ci scrivo altre puntate
771	BO100	4527.591	4533.508	5.917	True	False	0	0	0	0	0	0	0	0	False	False	False	False	False	_	False	0	0	0	20	e::h la scrittura non sarà all' altezza degli sceneggiatori, ma chissene frega. io voglio ancora sapere come va a finire,	e::h la scrittura non sarà all' altezza degli sceneggiatori, ma chissene frega. io voglio ancora sapere come va a finire,	eh la scrittura non sarà all' altezza degli sceneggiatori ma chissene frega io voglio ancora sapere come va a finire
772	BO100	4533.781	4535.926	2.145	True	False	0	0	0	0	0	0	0	0	False	False	False	False	False	_	False	1	0	0	5	con queste: (.) con queste storie.	con queste: {P} con queste storie.	con queste {P} con queste storie
773	BO100	4536.253	4537.653	1.4	True	False	0	0	0	0	0	0	0	0	False	False	False	False	False	_	False	0	0	0	4	oppure la fan art.	oppure la fan art.	oppure la fan art
774	BO100	4537.7	4541.34	3.64	True	False	0	0	0	0	0	0	0	0	False	False	False	False	False	_	False	1	0	0	5	e quindi, la (.) rielaborazione, artistica,	e quindi, la {P} rielaborazione, artistica,	e quindi la {P} rielaborazione artistica
775	BO100	4541.428	4544.938	3.51	True	False	0	0	0	0	0	0	0	0	False	False	False	False	False	_	False	1	0	0	6	e:h di (.) spesso di rara kitschitudine,	e:h di {P} spesso di rara kitschitudine,	eh di {P} spesso di rara kitschitudine
776	BO100	4545.303	4547.41	2.107	True	False	0	0	0	0	0	0	0	0	False	False	False	False	False	_	False	0	0	0	4	<e:h con dei disegni>,	<e:h con dei disegni>,	eh con dei disegni
777	BO100	4547.51	4553.74	6.23	True	False	0	0	0	0	0	0	0	0	False	False	False	False	False	_	False	0	0	0	16	con delle elaborazioni grafiche, con dei montaggi, fatti a partire da questi personaggi di serie televisive,	con delle elaborazioni grafiche, con dei montaggi, fatti a partire da questi personaggi di serie televisive,	con delle elaborazioni grafiche con dei montaggi fatti a partire da questi personaggi di serie televisive
778	BO100	4553.806	4559.345	5.539	True	False	0	0	0	0	0	0	0	0	False	False	False	False	False	_	False	1	0	0	11	eh o di altri di film. e:h (.) cantanti e così via,	eh o di altri di film. e:h {P} cantanti e così via,	eh o di altri di film eh {P} cantanti e così via
779	BO100	4559.785	4563.775	3.99	True	False	0	0	0	0	0	0	0	0	False	False	False	False	False	_	False	1	0	0	7	con (.) pretese artistiche più o meno raggiunte.	con {P} pretese artistiche più o meno raggiunte.	con {P} pretese artistiche più o meno raggiunte
780	BO100	4563.903	4567.7	3.797	True	False	0	0	0	0	0	0	0	0	False	False	False	False	False	_	False	0	0	0	13	ma anche quello diventa un linguaggio, e ancora i meme, e così via.	ma anche quello diventa un linguaggio, e ancora i meme, e così via.	ma anche quello diventa un linguaggio e ancora i meme e così via
781	BO100	4568.513	4572.93	4.417	True	False	0	0	0	0	0	0	0	0	False	False	False	False	False	_	False	0	0	0	13	nel panorama mediale ibrido e sempre in evoluzione, l' industria se ne accorge.	nel panorama mediale ibrido e sempre in evoluzione, l' industria se ne accorge.	nel panorama mediale ibrido e sempre in evoluzione l' industria se ne accorge
782	BO100	4573.49	4575.125	1.635	True	False	0	0	0	0	0	0	0	0	False	False	False	False	False	_	False	0	0	0	4	e l' industria reagisce.	e l' industria reagisce.	e l' industria reagisce
783	BO100	4575.278	4578.64	3.362	True	False	0	0	0	0	0	0	0	0	False	False	False	False	False	_	False	0	0	0	6	creando essa stessa delle estenzioni mediali.	creando essa stessa delle estenzioni mediali.	creando essa stessa delle estenzioni mediali
784	BO100	4580.143	4581.44	1.297	True	False	0	0	0	0	0	0	0	0	False	False	False	False	False	_	False	0	0	0	6	non ti è bastato il film?	non ti è bastato il film?	non ti è bastato il film
785	BO100	4581.61	4588.19	6.58	True	False	0	0	0	0	1	0	0	0	False	False	False	False	False	_	False	0	0	0	16	facciamo anche questa clip che ti metto su youtube, questo videogioco che puoi comprare nei negozi (.)	facciamo anche questa clip che ti metto su youtube, questo videogioco che puoi comprare nei negozi	facciamo anche questa clip che ti metto su youtube questo videogioco che puoi comprare nei negozi
786	BO100	4588.36	4598.366	10.006	True	False	0	0	0	0	0	0	0	0	False	False	False	False	False	_	False	0	0	0	23	e:h appositamente, e magari: stimolo anche la partecipazione degli utenti con un concorso a tema legato ai contenuti della narrazione di questo film.	e:h appositamente, e magari: stimolo anche la partecipazione degli utenti con un concorso a tema legato ai contenuti della narrazione di questo film.	eh appositamente e magari stimolo anche la partecipazione degli utenti con un concorso a tema legato ai contenuti della narrazione di questo film
787	BO100	4599.82	4601.756	1.936	True	False	0	0	0	0	0	0	0	0	False	False	False	False	False	_	False	0	0	0	4	le possibilità di sinergia.	le possibilità di sinergia.	le possibilità di sinergia
788	BO100	4601.908	4603.756	1.848	True	False	0	0	0	0	0	0	0	0	False	False	False	False	False	_	False	0	0	0	5	fra aziende tra loro integrate.	fra aziende tra loro integrate.	fra aziende tra loro integrate
789	BO100	4605.11	4606.99	1.88	True	False	0	0	0	0	0	0	0	0	False	False	False	False	False	_	False	0	0	0	4	la creazione di franchise.	la creazione di franchise.	la creazione di franchise
790	BO100	4607.5	4608.816	1.316	True	False	0	0	0	0	1	0	0	0	False	False	False	False	False	_	False	0	0	0	3	i grandi marchi (.)	i grandi marchi	i grandi marchi
791	BO100	4608.971	4613.625	4.654	True	False	0	0	0	0	0	0	0	0	False	False	False	False	False	_	False	1	0	0	16	che bastano da soli a creare un po' di affetto (.) in chi in chi li vede.	che bastano da soli a creare un po' di affetto {P} in chi in chi li vede.	che bastano da soli a creare un po' di affetto {P} in chi in chi li vede
792	BO100	4614.72	4620.88	6.16	True	False	0	0	0	0	0	0	0	0	False	False	False	False	False	_	False	1	0	0	13	e (.) rispetto ai quali costruisco una mitologia costruisco un ecosistema costruisco un insieme,	e {P} rispetto ai quali costruisco una mitologia costruisco un ecosistema costruisco un insieme,	e {P} rispetto ai quali costruisco una mitologia costruisco un ecosistema costruisco un insieme
793	BO100	4621.175	4624.906	3.731	True	False	0	0	0	0	0	0	0	0	False	False	False	False	False	_	False	1	0	0	9	di storie di narrazione più o meno (.) strettamente legate.	di storie di narrazione più o meno {P} strettamente legate.	di storie di narrazione più o meno {P} strettamente legate
794	BO100	4625.033	4628.5	3.467	True	False	0	0	0	0	0	0	0	0	False	False	False	False	False	_	False	0	0	0	12	vedremo che proprio questo sarà il passaggio successivo della riflessione di jenkins.	vedremo che proprio questo sarà il passaggio successivo della riflessione di jenkins.	vedremo che proprio questo sarà il passaggio successivo della riflessione di jenkins
795	BO100	4629.388	4630.643	1.255	True	False	0	0	0	0	0	0	0	0	False	False	False	False	False	_	False	0	0	0	3	creo dei brand.	creo dei brand.	creo dei brand
796	BO100	4630.82	4631.676	0.856	True	False	0	0	0	0	0	0	0	0	False	False	False	False	False	_	False	0	0	0	2	molto forti.	molto forti.	molto forti
797	BO100	4632.806	4639.01	6.204	True	False	0	0	0	0	0	0	0	0	False	False	False	False	False	_	False	0	0	1, x-factor.	15	anche, non soltanto nelle narrazioni anche: nei programmi di intrattenimento. pensate a un marchio come x-factor.	anche, non soltanto nelle narrazioni anche: nei programmi di intrattenimento. pensate a un marchio come x-factor.	anche non soltanto nelle narrazioni anche nei programmi di intrattenimento pensate a un marchio come x-factor.
798	BO100	4639.516	4643.17	3.654	True	False	0	0	0	0	0	0	0	0	False	False	False	False	False	_	False	0	0	0	9	e a come stimoli costantemente una partecipazione degli utenti.	e a come stimoli costantemente una partecipazione degli utenti.	e a come stimoli costantemente una partecipazione degli utenti
799	BO100	4644.2	4645.758	1.558	True	False	0	0	0	0	0	0	0	0	False	False	False	False	False	_	False	0	0	0	7	in maniera diretta e in maniere indiretta.	in maniera diretta e in maniere indiretta.	in maniera diretta e in maniere indiretta
800	BO100	4646.153	4659.14	12.987	True	False	0	0	0	0	0	0	0	0	False	False	False	False	False	_	False	2	0	0	34	e poi probabilmente le (.) la sfrutti la convogli alle logiche industriali, cercando (.) eh di far aquistare almeno a qualcuno di voi, e qualcuno lo avrà anche fatto, gli inediti dei concorrenti di quest' anno.	e poi probabilmente le {P} la sfrutti la convogli alle logiche industriali, cercando {P} eh di far aquistare almeno a qualcuno di voi, e qualcuno lo avrà anche fatto, gli inediti dei concorrenti di quest' anno.	e poi probabilmente le {P} la sfrutti la convogli alle logiche industriali cercando {P} eh di far aquistare almeno a qualcuno di voi e qualcuno lo avrà anche fatto gli inediti dei concorrenti di quest' anno
801	BO100	4659.678	4663.021	3.343	True	False	0	0	0	0	0	0	0	0	False	False	False	False	False	_	False	1	0	0	9	che erano (.) in testa alle=a classifica di itunes,	che erano {P} in testa alle=a classifica di itunes,	che erano {P} in testa alle a classifica di itunes
802	BO100	4663.12	4665.053	1.933	True	False	0	0	0	0	0	0	0	0	False	False	False	False	False	_	False	0	0	0	8	e:h non più tardi di qualche giorno fa.	e:h non più tardi di qualche giorno fa.	eh non più tardi di qualche giorno fa
803	BO100	4667.931	4671.521	3.59	True	False	0	0	0	0	0	0	0	0	False	False	False	False	False	_	False	0	0	0	11	vediamo alcuni esempi allora di: di survivor vi ho già detto.	vediamo alcuni esempi allora di: di survivor vi ho già detto.	vediamo alcuni esempi allora di di survivor vi ho già detto
804	BO100	4671.681	4677.223	5.542	True	False	0	0	0	0	0	0	0	0	False	False	False	False	False	_	False	1	0	0	15	quindi (.) le informazioni condivise da un' intelligenza collettiva per caercare di capire che cosa succede.	quindi {P} le informazioni condivise da un' intelligenza collettiva per caercare di capire che cosa succede.	quindi {P} le informazioni condivise da un' intelligenza collettiva per caercare di capire che cosa succede
