tu_id	speaker	start	end	duration	include	variation	W:normalized_spaces	W:numbers	W:accents	W:non_jefferson	W:pauses_trim	W:prosodic_trim	W:moved_boundaries	W:switches	E:volume	E:pace	E:guess	E:overlap	E:overlap_mismatch	E:overlap_duration	E:unmatched_overlaps	T:shortpauses	T:metalinguistic	T:errors	T:linguistic	original	text	orthographic
413	BO100	2629.056	2632.36	3.304	True	False	0	0	0	0	0	0	0	0	False	False	False	False	False	_	False	0	0	0	9	quello che importano sono le connessioni a livello sintagmatico.	quello che importano sono le connessioni a livello sintagmatico.	quello che importano sono le connessioni a livello sintagmatico
414	BO100	2632.793	2638.56	5.767	True	False	0	0	0	0	0	0	0	0	False	False	False	False	False	_	False	1	0	0	18	cosa (.) una volta che ho scelto, tra la virtualità dei miei personaggi possibili, quale è il mio personaggio,	cosa {P} una volta che ho scelto, tra la virtualità dei miei personaggi possibili, quale è il mio personaggio,	cosa {P} una volta che ho scelto tra la virtualità dei miei personaggi possibili quale è il mio personaggio
415	BO100	2638.88	2647.6	8.72	True	False	0	0	0	0	0	0	0	0	False	False	False	False	False	_	False	1	0	0	27	quello che mi importa è capire che cosa faccio fare, a quel personaggio. come si (.) evolve la narrazione assieme a una serie di attualizzazioni di altre virtualità.	quello che mi importa è capire che cosa faccio fare, a quel personaggio. come si {P} evolve la narrazione assieme a una serie di attualizzazioni di altre virtualità.	quello che mi importa è capire che cosa faccio fare a quel personaggio come si {P} evolve la narrazione assieme a una serie di attualizzazioni di altre virtualità
416	BO100	2650.22	2654.726	4.506	True	False	0	0	0	0	0	0	0	0	False	False	False	False	False	_	False	0	0	0	11	manovic ci dice. la creatività del database funziona in maniera opposta.	manovic ci dice. la creatività del database funziona in maniera opposta.	manovic ci dice la creatività del database funziona in maniera opposta
417	BO100	2656.198	2661.386	5.188	True	False	0	0	0	0	0	0	0	0	False	False	False	False	False	_	False	0	0	0	10	è molto più importante, l' insieme paradigmatico delle scelte possibili,	è molto più importante, l' insieme paradigmatico delle scelte possibili,	è molto più importante l' insieme paradigmatico delle scelte possibili
418	BO100	2663.075	2664.315	1.24	True	False	0	0	0	0	0	0	0	0	False	False	False	False	False	_	False	0	0	0	2	che non	che non	che non
419	BO100	2664.5	2669.038	4.538	True	False	0	0	0	0	0	0	0	0	False	False	False	False	False	_	False	0	0	0	7	l' aspetto sintagmatico, delle connessioni. dei legami.	l' aspetto sintagmatico, delle connessioni. dei legami.	l' aspetto sintagmatico delle connessioni dei legami
420	BO100	2670.343	2675.88	5.537	True	False	0	0	2	0	0	0	0	0	False	False	False	False	False	_	False	0	0	0	14	perchè? perchè nel database, gli elementi paradigmatici ci sono tutti. e ci sono già.	perché? perché nel database, gli elementi paradigmatici ci sono tutti. e ci sono già.	perché perché nel database gli elementi paradigmatici ci sono tutti e ci sono già
421	BO100	2677.0	2683.383	6.383	True	False	0	0	0	0	0	0	0	0	False	False	False	False	False	_	False	0	0	0	18	io le scelte possibili, le ho tutte li presenti che occupano ciascuna una delle celle di questo database.	io le scelte possibili, le ho tutte li presenti che occupano ciascuna una delle celle di questo database.	io le scelte possibili le ho tutte li presenti che occupano ciascuna una delle celle di questo database
422	BO100	2685.023	2687.88	2.857	True	False	0	0	0	0	0	0	0	0	False	False	False	False	False	_	False	0	0	0	7	le connessioni invece sono temporanee. sono virtuali.	le connessioni invece sono temporanee. sono virtuali.	le connessioni invece sono temporanee sono virtuali
423	BO100	2688.586	2695.271	6.685	True	False	0	0	0	0	0	0	0	0	False	False	False	False	False	_	False	0	0	0	23	a seconda di come decido di affrontare il database, e di dargli una chiave narrativa, queste connessioni possono essere di tanti tipi diversi.	a seconda di come decido di affrontare il database, e di dargli una chiave narrativa, queste connessioni possono essere di tanti tipi diversi.	a seconda di come decido di affrontare il database e di dargli una chiave narrativa queste connessioni possono essere di tanti tipi diversi
424	BO100	2696.208	2697.523	1.315	True	False	0	0	0	0	0	0	0	0	False	False	False	False	False	_	False	0	0	0	1	temporanee.	temporanee.	temporanee
425	BO100	2698.633	2705.011	6.378	True	False	0	0	0	0	0	0	0	0	False	False	False	False	False	_	False	0	0	0	22	di nuovo il videogioco ci da abbastanza l' idea. di tutto questo. fin dalla possibilità di scegliere il nostro personaggio dall' inizio.	di nuovo il videogioco ci da abbastanza l' idea. di tutto questo. fin dalla possibilità di scegliere il nostro personaggio dall' inizio.	di nuovo il videogioco ci da abbastanza l' idea di tutto questo fin dalla possibilità di scegliere il nostro personaggio dall' inizio
426	BO100	2707.396	2711.785	4.389	True	False	0	0	0	0	0	0	0	0	False	False	False	False	False	_	False	0	0	0	15	e a seconda del personaggio che scegliamo, a seconda del gioco di cui si tratta,	e a seconda del personaggio che scegliamo, a seconda del gioco di cui si tratta,	e a seconda del personaggio che scegliamo a seconda del gioco di cui si tratta
427	BO100	2711.918	2720.765	8.847	True	False	0	0	0	0	0	0	0	0	False	False	False	False	False	_	False	0	0	0	28	decidere di andare in determinate direzioni, di avere certi poteri, di fare determinati incontri. però è piu importante la scelta paradigmatica che non la connessione sintagmatica, che cambia.	decidere di andare in determinate direzioni, di avere certi poteri, di fare determinati incontri. però è piu importante la scelta paradigmatica che non la connessione sintagmatica, che cambia.	decidere di andare in determinate direzioni di avere certi poteri di fare determinati incontri però è piu importante la scelta paradigmatica che non la connessione sintagmatica che cambia
428	BO100	2721.068	2724.136	3.068	True	False	0	0	0	0	0	0	0	0	False	False	False	False	False	_	False	0	0	0	7	mentre nella narrazione tradizionale vale il contrario.	mentre nella narrazione tradizionale vale il contrario.	mentre nella narrazione tradizionale vale il contrario
429	BO100	2727.2	2729.108	1.908	True	False	0	0	0	0	0	0	0	0	False	False	False	False	False	_	False	0	0	0	6	di nuovo un elemento di novità,	di nuovo un elemento di novità,	di nuovo un elemento di novità
430	BO100	2730.573	2736.438	5.865	True	False	0	0	0	0	0	0	0	0	False	False	False	False	False	_	False	0	0	0	16	di rivoluzione, giudicate voi quanto radicale. rispetto a quello che è un modello precedente di narrazione.	di rivoluzione, giudicate voi quanto radicale. rispetto a quello che è un modello precedente di narrazione.	di rivoluzione giudicate voi quanto radicale rispetto a quello che è un modello precedente di narrazione
431	BO100	2737.061	2742.656	5.595	True	False	0	0	0	0	0	0	0	0	False	False	False	False	False	_	False	0	0	0	18	bolter e grusin ci dicono c' è una diretta continuità tra i media precedenti e i media digitali,	bolter e grusin ci dicono c' è una diretta continuità tra i media precedenti e i media digitali,	bolter e grusin ci dicono c' è una diretta continuità tra i media precedenti e i media digitali
432	BO100	2743.153	2748.313	5.16	True	False	0	0	1	0	0	0	0	0	False	False	False	False	False	_	False	1	0	0	10	manovic ci dice (.) attenzione. perchè, quella continuità ha una superfice,	manovic ci dice {P} attenzione. perché, quella continuità ha una superfice,	manovic ci dice {P} attenzione perché quella continuità ha una superfice
433	BO100	2748.458	2752.016	3.558	True	False	0	0	0	0	0	0	0	0	False	False	False	False	False	_	False	0	0	0	11	se scavate sotto la superficie invece ci trovate un ribaltamento totale.	se scavate sotto la superficie invece ci trovate un ribaltamento totale.	se scavate sotto la superficie invece ci trovate un ribaltamento totale
434	BO100	2752.996	2762.6	9.604	True	False	0	0	0	0	0	0	0	0	False	False	False	False	False	_	False	1	0	0	31	non ve ne accorgete più di tanto, ma i meccanismi stessi su cui si fonda l' estetica sono stati cambiati, dall' adozione del database, dalla struttura dati dell' algoritmo (.) del software.	non ve ne accorgete più di tanto, ma i meccanismi stessi su cui si fonda l' estetica sono stati cambiati, dall' adozione del database, dalla struttura dati dell' algoritmo {P} del software.	non ve ne accorgete più di tanto ma i meccanismi stessi su cui si fonda l' estetica sono stati cambiati dall' adozione del database dalla struttura dati dell' algoritmo {P} del software
435	BO100	2766.56	2769.965	3.405	True	False	0	0	0	0	0	0	0	0	False	False	False	False	False	_	False	2	0	0	7	quindi metto (.) giusto per (.) completare il quadro,	quindi metto {P} giusto per {P} completare il quadro,	quindi metto {P} giusto per {P} completare il quadro
436	BO100	2770.521	2779.49	8.969	True	False	0	0	0	0	0	0	0	0	False	False	False	False	False	_	False	0	0	0	21	un' immagine di uno dei lavori  recenti, di manovic. che poi appunto partendo da:: visual artist,  anche, non soltanto da studioso,	un' immagine di uno dei lavori recenti, di manovic. che poi appunto partendo da:: visual artist, anche, non soltanto da studioso,	un' immagine di uno dei lavori recenti di manovic che poi appunto partendo da visual artist anche non soltanto da studioso
437	BO100	2779.651	2788.16	8.509	True	False	0	0	0	0	0	0	0	0	False	False	False	False	False	_	False	1	0	0	29	poi si è messo a (.)  a elaborarle queste logiche di database, per esempio cercando una serie di ricorrenze una serie di connesioni all' interno di basi di dati grafiche.	poi si è messo a {P} a elaborarle queste logiche di database, per esempio cercando una serie di ricorrenze una serie di connesioni all' interno di basi di dati grafiche.	poi si è messo a {P} a elaborarle queste logiche di database per esempio cercando una serie di ricorrenze una serie di connesioni all' interno di basi di dati grafiche
438	BO100	2788.52	2792.36	3.84	True	False	0	0	0	0	0	0	0	0	False	False	False	False	False	_	False	1	0	0	12	eh questo è (.) l' esempio di tutte le copertine di time magazine	eh questo è {P} l' esempio di tutte le copertine di time magazine	eh questo è {P} l' esempio di tutte le copertine di time magazine
439	BO100	2792.64	2806.785	14.145	True	False	0	0	0	0	0	0	0	0	False	False	False	False	False	_	False	1	0	0	39	e::h di time magazine americano, una base di dati quale poi (.) con uno sguardo critico con uno sguardo artistico, manovic va a identificare tutta una serie di ricorrenze, tutta una serie di possibili percorsi, tutta una serie di connessioni.	e::h di time magazine americano, una base di dati quale poi {P} con uno sguardo critico con uno sguardo artistico, manovic va a identificare tutta una serie di ricorrenze, tutta una serie di possibili percorsi, tutta una serie di connessioni.	eh di time magazine americano una base di dati quale poi {P} con uno sguardo critico con uno sguardo artistico manovic va a identificare tutta una serie di ricorrenze tutta una serie di possibili percorsi tutta una serie di connessioni
440	BO100	2807.033	2816.495	9.462	True	False	0	0	0	0	0	0	0	0	False	False	False	False	False	_	False	2	0	0	24	facendosi aiutare dal database, facendosi aiutare dai software (.) e:h rispetto ai quali (.) e:h si::: ai ai quali chiede di elaborare, questo insieme di dati.	facendosi aiutare dal database, facendosi aiutare dai software {P} e:h rispetto ai quali {P} e:h si::: ai ai quali chiede di elaborare, questo insieme di dati.	facendosi aiutare dal database facendosi aiutare dai software {P} eh rispetto ai quali {P} eh si ai ai quali chiede di elaborare questo insieme di dati
441	BO100	2816.655	2817.678	1.023	True	False	0	0	0	0	0	0	0	0	False	False	False	False	False	_	False	0	0	0	1	okay?	okay?	okay
442	BO100	2818.016	2819.118	1.102	True	False	0	0	0	0	0	0	0	0	False	False	False	False	False	_	False	0	0	0	2	tutto chiaro?	tutto chiaro?	tutto chiaro
443	BO100	2820.996	2824.308	3.312	True	False	0	0	0	0	0	0	0	0	False	False	False	False	False	_	False	2	0	0	6	filo denso però (.) spero (.) abbastanza chiaro.	filo denso però {P} spero {P} abbastanza chiaro.	filo denso però {P} spero {P} abbastanza chiaro
444	BO100	2826.408	2832.753	6.345	True	False	0	0	0	0	0	0	0	0	False	False	False	False	False	_	False	0	0	1, manovic,.	17	comunque, mi raccomando leggete le: le pagine e: le pagine di manovic,. se non l' avete già fatto,	comunque, mi raccomando leggete le: le pagine e: le pagine di manovic,. se non l' avete già fatto,	comunque mi raccomando leggete le le pagine e le pagine di manovic,. se non l' avete già fatto
445	BO100	2832.908	2837.923	5.015	True	False	0	0	0	0	0	0	0	0	False	False	False	False	False	_	False	0	0	0	14	se poi avrete delle: delle questioni delle domande dei dubbi, e: sapete dove trovarmi.	se poi avrete delle: delle questioni delle domande dei dubbi, e: sapete dove trovarmi.	se poi avrete delle delle questioni delle domande dei dubbi e sapete dove trovarmi
446	BO100	2839.966	2841.901	1.935	True	False	0	0	0	0	0	0	0	0	False	False	False	False	False	_	False	0	0	0	2	terzo quadro	terzo quadro	terzo quadro
447	BO100	2842.448	2851.32	8.872	True	False	0	0	0	0	0	0	0	0	False	False	False	False	False	_	False	1	0	0	26	teorico e concettuale, rispetto all' estetica dei media digitali. che: che affrontiamo, e (.) tanto per cambiare una parola che non avete mai sentito in queste lezioni,	teorico e concettuale, rispetto all' estetica dei media digitali. che: che affrontiamo, e {P} tanto per cambiare una parola che non avete mai sentito in queste lezioni,	teorico e concettuale rispetto all' estetica dei media digitali che che affrontiamo e {P} tanto per cambiare una parola che non avete mai sentito in queste lezioni
448	BO100	2851.68	2852.68	1.0	True	False	0	0	0	0	0	0	0	0	False	False	False	False	False	_	False	0	0	0	1	convergenza.	convergenza.	convergenza
449	BO100	2853.791	2861.88	8.089	True	False	0	0	0	0	0	0	0	0	False	False	False	False	False	_	False	1	0	0	19	abbiamo già parlato (.) di convergenza tecnologica e di convergenza economica,   ithiel de sola pool è stato la nostra guida,	abbiamo già parlato {P} di convergenza tecnologica e di convergenza economica, ithiel de sola pool è stato la nostra guida,	abbiamo già parlato {P} di convergenza tecnologica e di convergenza economica ithiel de sola pool è stato la nostra guida
450	BO100	2862.48	2871.495	9.015	True	False	0	0	0	0	0	0	0	0	False	False	False	False	False	_	False	1	0	0	20	nell' affrontare questi livelli, questi tipi di convergenza, e nel portarli anche verso uno sbocco (.) politico, di critica del sistema.	nell' affrontare questi livelli, questi tipi di convergenza, e nel portarli anche verso uno sbocco {P} politico, di critica del sistema.	nell' affrontare questi livelli questi tipi di convergenza e nel portarli anche verso uno sbocco {P} politico di critica del sistema
451	BO100	2872.945	2886.756	13.811	True	False	0	0	0	0	0	0	0	0	False	False	False	False	False	_	False	1	0	0	36	ragionando da un punto di vista estetico, ma non soltanto estetico. estetico sociale, estetico culturale, anche un pochino più largo, del: del solo dibattito estetico in cui si collocano (.) i due: i due quadri concettuali precedenti,	ragionando da un punto di vista estetico, ma non soltanto estetico. estetico sociale, estetico culturale, anche un pochino più largo, del: del solo dibattito estetico in cui si collocano {P} i due: i due quadri concettuali precedenti,	ragionando da un punto di vista estetico ma non soltanto estetico estetico sociale estetico culturale anche un pochino più largo del del solo dibattito estetico in cui si collocano {P} i due i due quadri concettuali precedenti
452	BO100	2887.485	2890.783	3.298	True	False	0	0	0	0	0	0	0	0	False	False	False	False	False	_	False	0	0	0	6	aggiungiamo un aggettivo, che è culturale.	aggiungiamo un aggettivo, che è culturale.	aggiungiamo un aggettivo che è culturale
453	BO100	2891.226	2894.591	3.365	True	False	0	0	0	0	0	0	0	0	False	False	False	False	False	_	False	0	0	0	5	e affrontiamo con questo elemento,	e affrontiamo con questo elemento,	e affrontiamo con questo elemento
454	BO100	2895.865	2897.745	1.88	True	False	0	0	0	0	0	0	0	0	False	False	False	False	False	_	False	0	0	0	3	uno dei pilastri	uno dei pilastri	uno dei pilastri
455	BO100	2899.4	2903.668	4.268	True	False	0	0	0	0	0	0	0	0	False	False	False	False	False	_	False	1	0	0	8	discretamente: (.) discretamente furbi nel cotruirsi come pilastri. vabbè	discretamente: {P} discretamente furbi nel cotruirsi come pilastri. vabbè	discretamente {P} discretamente furbi nel cotruirsi come pilastri vabbè
456	BO100	2903.772	2906.203	2.431	True	False	0	0	0	0	0	0	0	0	False	False	False	False	False	_	False	0	0	0	4	comunque, come henry jenkins.	comunque, come henry jenkins.	comunque come henry jenkins
457	BO100	2906.844	2912.403	5.559	True	False	0	0	0	0	0	0	0	0	False	False	False	False	False	_	False	0	0	0	17	che magari l' avrete già inconcia:~ incrociato in altri corsi. chi ha gia sentito nominare henry jenkins?	che magari l' avrete già inconcia:~ incrociato in altri corsi. chi ha gia sentito nominare henry jenkins?	che magari l' avrete già inconcia~ incrociato in altri corsi chi ha gia sentito nominare henry jenkins
458	BO100	2914.0	2916.6	2.6	True	False	0	0	0	0	0	0	0	0	False	False	False	False	False	_	False	0	0	0	8	non siate timidi. qualche mano alzata la vedo,	non siate timidi. qualche mano alzata la vedo,	non siate timidi qualche mano alzata la vedo
459	BO100	2917.0	2924.8	7.8	True	False	0	0	0	0	0	0	0	0	False	False	False	False	False	_	False	1	0	0	29	okay. vabbè, se non l' avete sentito fin' ora, nei prossimi anni (.) lo troverete da tutte le parti, e in tutte le salse, come in questa lezione de resto.	okay. vabbè, se non l' avete sentito fin' ora, nei prossimi anni {P} lo troverete da tutte le parti, e in tutte le salse, come in questa lezione de resto.	okay vabbè se non l' avete sentito fin' ora nei prossimi anni {P} lo troverete da tutte le parti e in tutte le salse come in questa lezione de resto
460	BO100	2926.031	2927.768	1.737	True	False	0	0	0	0	0	0	0	0	False	False	False	False	False	_	False	0	0	0	2	convergenza culturale.	convergenza culturale.	convergenza culturale
461	BO100	2928.243	2940.56	12.317	True	False	0	0	0	0	0	0	0	0	False	False	False	False	False	_	False	1	0	0	32	il libro che scrive henry jenkins, e::h che ha una rilevanza mondiale, e che per alcuni anni diventa quasi la bibbia di chiunque: (.) affronti il tema dei media, e dei media digitali,	il libro che scrive henry jenkins, e::h che ha una rilevanza mondiale, e che per alcuni anni diventa quasi la bibbia di chiunque: {P} affronti il tema dei media, e dei media digitali,	il libro che scrive henry jenkins eh che ha una rilevanza mondiale e che per alcuni anni diventa quasi la bibbia di chiunque {P} affronti il tema dei media e dei media digitali
462	BO100	2940.976	2954.833	13.857	True	False	0	0	0	0	0	0	0	0	False	False	False	False	False	_	False	3	0	0	46	e:h prima (.) di (.) avere come dire una:: una sua collocazione più precisa all' interno di un dibattito più ampio, cosa che è stata fatta negli anni successivi per cui adesso (.) nessuno considererebbe più jenkins come un guru assoluto, come è stato fino a qualche anno fa,	e:h prima {P} di {P} avere come dire una:: una sua collocazione più precisa all' interno di un dibattito più ampio, cosa che è stata fatta negli anni successivi per cui adesso {P} nessuno considererebbe più jenkins come un guru assoluto, come è stato fino a qualche anno fa,	eh prima {P} di {P} avere come dire una una sua collocazione più precisa all' interno di un dibattito più ampio cosa che è stata fatta negli anni successivi per cui adesso {P} nessuno considererebbe più jenkins come un guru assoluto come è stato fino a qualche anno fa
463	BO100	2955.92	2960.025	4.105	True	False	0	0	0	0	0	0	0	0	False	False	False	False	False	_	False	2	0	0	8	comunque (.) scrive un libro dal titolo (.) convergence culture.	comunque {P} scrive un libro dal titolo {P} convergence culture.	comunque {P} scrive un libro dal titolo {P} convergence culture
464	BO100	2960.84	2962.558	1.718	True	False	0	0	0	0	0	0	0	0	False	False	False	False	False	_	False	1	0	0	2	cultura (.) convergente.	cultura {P} convergente.	cultura {P} convergente
465	BO100	2964.256	2968.973	4.717	True	False	0	0	0	0	0	0	0	0	False	False	False	False	False	_	False	1	0	0	17	e qua (.) vabbè. possiamo prenderla in tutte e due i modi, invertire i sostanivi e gli aggettivi.	e qua {P} vabbè. possiamo prenderla in tutte e due i modi, invertire i sostanivi e gli aggettivi.	e qua {P} vabbè possiamo prenderla in tutte e due i modi invertire i sostanivi e gli aggettivi
466	BO100	2969.176	2975.068	5.892	True	False	0	0	0	0	0	0	0	0	False	False	False	False	False	_	False	0	0	0	18	la cultura è convergente. la convergenza è anche culturale. a seconda di come:  di come la si guardi.	la cultura è convergente. la convergenza è anche culturale. a seconda di come: di come la si guardi.	la cultura è convergente la convergenza è anche culturale a seconda di come di come la si guardi
467	BO100	2975.445	2980.416	4.971	True	False	0	0	0	0	0	0	0	0	False	False	False	False	False	_	False	0	0	0	16	il libro è del duemilaesei, viene tradotto in italia l' anno dopo, nel duemilaesette, da apogeo,	il libro è del duemilaesei, viene tradotto in italia l' anno dopo, nel duemilaesette, da apogeo,	il libro è del duemilaesei viene tradotto in italia l' anno dopo nel duemilaesette da apogeo
468	BO100	2980.761	2992.08	11.319	True	False	0	0	0	0	0	0	0	0	False	False	False	False	False	_	False	1	0	0	26	e ha una sua:: una sua rilevanza molto ampia nel dibattito dei media studies, dei digital media studies, ma anche nel dibattito (.) nel dibattito giornalistico. recente.	e ha una sua:: una sua rilevanza molto ampia nel dibattito dei media studies, dei digital media studies, ma anche nel dibattito {P} nel dibattito giornalistico. recente.	e ha una sua una sua rilevanza molto ampia nel dibattito dei media studies dei digital media studies ma anche nel dibattito {P} nel dibattito giornalistico recente
469	BO100	2992.303	2999.983	7.68	True	False	0	0	1	0	0	0	0	0	False	False	False	False	False	_	False	1	0	0	17	e:h una:: una rilevanza molto ampia, meritata, perchè sicuramente si tratta di un' intuizione molto: (.) molto grande,	e:h una:: una rilevanza molto ampia, meritata, perché sicuramente si tratta di un' intuizione molto: {P} molto grande,	eh una una rilevanza molto ampia meritata perché sicuramente si tratta di un' intuizione molto {P} molto grande
470	BO100	3000.265	3013.08	12.815	True	False	0	0	0	0	0	0	0	0	False	False	False	False	False	_	False	0	0	0	39	a volte=è interpretata in chiave un po' troppo acritica. rispetto ad alcuni difetti che comunque anche questo tipo di approccio, come un po' tutti gli approcci e:h a un certo punto svela, e ad un certo punto rivela.	a volte=è interpretata in chiave un po' troppo acritica. rispetto ad alcuni difetti che comunque anche questo tipo di approccio, come un po' tutti gli approcci e:h a un certo punto svela, e ad un certo punto rivela.	a volte è interpretata in chiave un po' troppo acritica rispetto ad alcuni difetti che comunque anche questo tipo di approccio come un po' tutti gli approcci eh a un certo punto svela e ad un certo punto rivela
471	BO100	3013.895	3020.488	6.593	True	False	0	0	0	0	0	0	0	0	False	False	False	False	False	_	False	1	0	0	19	la convergenza è un fenomeno (.) che avviene a un livello tecnologico, è un fenomeno che avviene a livello economico,	la convergenza è un fenomeno {P} che avviene a un livello tecnologico, è un fenomeno che avviene a livello economico,	la convergenza è un fenomeno {P} che avviene a un livello tecnologico è un fenomeno che avviene a livello economico
472	BO100	3020.576	3027.173	6.597	True	False	0	0	0	0	0	0	0	0	False	False	False	False	False	_	False	0	0	0	19	abbiam parlato di piattaforme che si fondono tra di loro. di aziende. che si aquisiscuno l' un l' altra,	abbiam parlato di piattaforme che si fondono tra di loro. di aziende. che si aquisiscuno l' un l' altra,	abbiam parlato di piattaforme che si fondono tra di loro di aziende che si aquisiscuno l' un l' altra
473	BO100	3027.346	3031.44	4.094	True	False	0	0	0	0	0	0	0	0	False	False	False	False	False	_	False	0	0	0	9	ma è anche un punto di vista estetico. linguistico.	ma è anche un punto di vista estetico. linguistico.	ma è anche un punto di vista estetico linguistico
474	BO100	3031.723	3033.82	2.097	True	False	0	0	0	0	0	0	0	0	False	False	False	False	False	_	False	0	0	0	2	legato anche	legato anche	legato anche
475	BO100	3034.318	3037.705	3.387	True	False	0	0	0	0	0	0	0	0	False	False	False	False	False	_	False	1	0	0	11	ai (.) modi in cui si entra in contatto con il pubblico,	ai {P} modi in cui si entra in contatto con il pubblico,	ai {P} modi in cui si entra in contatto con il pubblico
476	BO100	3037.825	3039.993	2.168	True	False	0	0	0	0	0	0	0	0	False	False	False	False	False	_	False	0	0	0	3	e alla partecipazione.	e alla partecipazione.	e alla partecipazione
477	BO100	3040.588	3044.653	4.065	True	False	0	0	0	0	0	0	0	0	False	False	False	False	False	_	False	0	0	0	12	di questo stesso pubblico, rispetto ai testi mediali, e ai testi culturali.	di questo stesso pubblico, rispetto ai testi mediali, e ai testi culturali.	di questo stesso pubblico rispetto ai testi mediali e ai testi culturali
