tu_id	speaker	start	end	duration	include	variation	W:normalized_spaces	W:numbers	W:accents	W:non_jefferson	W:pauses_trim	W:prosodic_trim	W:moved_boundaries	W:switches	E:volume	E:pace	E:guess	E:overlap	E:overlap_mismatch	E:overlap_duration	E:unmatched_overlaps	T:shortpauses	T:metalinguistic	T:errors	T:linguistic	original	text	orthographic
189	BO100	1254.085	1262.8	8.715	True	False	0	0	0	0	0	0	0	0	False	False	False	False	False	_	False	0	0	0	18	rispetto::: rispetto bolter e grusin, che invece partivano da degli studi letteari artistici. di stampo più tradizionalmente umanistico,	rispetto::: rispetto bolter e grusin, che invece partivano da degli studi letteari artistici. di stampo più tradizionalmente umanistico,	rispetto rispetto bolter e grusin che invece partivano da degli studi letteari artistici di stampo più tradizionalmente umanistico
190	BO100	1262.866	1266.241	3.375	True	False	0	0	0	0	0	0	0	0	False	False	False	False	False	_	False	0	0	0	9	si colloca già, all' interno di una riflessione mediale,	si colloca già, all' interno di una riflessione mediale,	si colloca già all' interno di una riflessione mediale
191	BO100	1266.357	1277.449	11.092	True	False	0	0	0	0	0	0	0	0	False	True	False	False	False	_	False	2	0	0	24	è >considerato abitualmente uno dei fondatori delle così dette< digital humanities>. e quindi dell' applicazione (.) eh dei media digitali (.) allo studio, delle:: delle humanities,	è >considerato abitualmente uno dei fondatori delle così dette< digital humanities>. e quindi dell' applicazione {P} eh dei media digitali {P} allo studio, delle:: delle humanities,	è considerato abitualmente uno dei fondatori delle così dette digital humanities e quindi dell' applicazione {P} eh dei media digitali {P} allo studio delle delle humanities
192	BO100	1278.256	1289.518	11.262	True	False	0	0	0	0	0	0	0	0	False	False	False	False	False	_	False	1	0	0	19	e, e:: propone, un:: una chiave, un::: una chiave di lettura dell' estetica digitale, invece, in termini di (.) innovazione.	e, e:: propone, un:: una chiave, un::: una chiave di lettura dell' estetica digitale, invece, in termini di {P} innovazione.	e e propone un una chiave un una chiave di lettura dell' estetica digitale invece in termini di {P} innovazione
193	BO100	1290.343	1292.183	1.84	True	False	0	0	0	0	0	0	0	0	False	False	False	False	False	_	False	0	0	0	4	in termini di cambiamento.	in termini di cambiamento.	in termini di cambiamento
194	BO100	1294.0	1300.8	6.8	True	False	0	0	0	0	0	0	0	0	False	False	False	False	False	_	False	2	0	0	23	metto le subito le mani ma~ (.) avanti, faccio uno spoiler, così almeno poi (.) interpretate anche quello che vi dico e quello che leggerete	metto le subito le mani ma~ {P} avanti, faccio uno spoiler, così almeno poi {P} interpretate anche quello che vi dico e quello che leggerete	metto le subito le mani ma~ {P} avanti faccio uno spoiler così almeno poi {P} interpretate anche quello che vi dico e quello che leggerete
195	BO100	1301.128	1306.48	5.352	True	False	0	0	0	0	0	0	0	0	False	False	False	False	False	_	False	1	0	0	12	e:: secondo:: secondo le vostre chiavi, dal mio punto di vista (.) e::	e:: secondo:: secondo le vostre chiavi, dal mio punto di vista {P} e::	e secondo secondo le vostre chiavi dal mio punto di vista {P} e
196	BO100	1307.02	1317.311	10.291	True	False	0	0	0	0	0	0	0	0	False	False	False	False	False	_	False	1	0	0	26	il pensiero di manovic è (.) meno convincente. di altre: di altre posizioni. è decisamente più radicale:: e:h per certi versi, in certi passaggi anche più ispirato,	il pensiero di manovic è {P} meno convincente. di altre: di altre posizioni. è decisamente più radicale:: e:h per certi versi, in certi passaggi anche più ispirato,	il pensiero di manovic è {P} meno convincente di altre di altre posizioni è decisamente più radicale eh per certi versi in certi passaggi anche più ispirato
197	BO100	1317.586	1323.096	5.51	True	False	0	0	0	0	0	0	0	0	False	False	False	False	False	_	False	1	0	0	18	e:: è se~ senz' altro utile a darci un altro (.) punto di vista, un' altra chiave di lettura,	e:: è se~ senz' altro utile a darci un altro {P} punto di vista, un' altra chiave di lettura,	e è se~ senz' altro utile a darci un altro {P} punto di vista un' altra chiave di lettura
198	BO100	1323.31	1334.528	11.218	True	False	0	0	0	0	0	0	0	0	False	False	False	False	False	_	False	3	0	0	37	ris~ rispetto a questo spazio dell' estetica digitale dove, ve l' ho  detto giál' altra volta, io non ho risposte da darvi, ho solo (.) stimoli da offrirvi a partire dai quali (.) portare avanti una vostra (.) e: elaborazione,	ris~ rispetto a questo spazio dell' estetica digitale dove, ve l' ho detto giál' altra volta, io non ho risposte da darvi, ho solo {P} stimoli da offrirvi a partire dai quali {P} portare avanti una vostra {P} e: elaborazione,	ris~ rispetto a questo spazio dell' estetica digitale dove ve l' ho detto giál' altra volta io non ho risposte da darvi ho solo {P} stimoli da offrirvi a partire dai quali {P} portare avanti una vostra {P} e elaborazione
199	BO100	1334.815	1347.05	12.235	True	False	0	0	0	0	0	0	0	0	False	False	False	False	False	_	False	2	0	0	22	e: diciamo che::, la proposta radicale di manovic, e:: mi sembra, mi sembra, però, ripeto (.) è la mia (.) e:h personalissima opinione, e:::	e: diciamo che::, la proposta radicale di manovic, e:: mi sembra, mi sembra, però, ripeto {P} è la mia {P} e:h personalissima opinione, e:::	e diciamo che la proposta radicale di manovic e mi sembra mi sembra però ripeto {P} è la mia {P} eh personalissima opinione e
200	BO100	1347.718	1354.291	6.573	True	False	0	0	0	0	0	0	0	0	False	False	False	False	False	_	False	1	0	0	21	che si   dimentichi per strada una serie di elementi di continuità che invece ci sono e che vediamo costantemente (.) sott' occhio.	che si dimentichi per strada una serie di elementi di continuità che invece ci sono e che vediamo costantemente {P} sott' occhio.	che si dimentichi per strada una serie di elementi di continuità che invece ci sono e che vediamo costantemente {P} sott' occhio
201	BO100	1354.74	1361.508	6.768	True	False	0	0	0	0	0	0	0	0	False	False	False	False	False	_	False	0	0	0	17	e:h e::: non propriamente un~ un::::=na: una posizione opposta rispetto a quella di bolter e grusin,	e:h e::: non propriamente un~ un::::=na: una posizione opposta rispetto a quella di bolter e grusin,	eh e non propriamente un~ un na una posizione opposta rispetto a quella di bolter e grusin
202	BO100	1361.535	1369.725	8.19	True	False	0	0	0	0	0	0	0	0	False	False	False	False	False	_	False	2	0	0	21	e: che trovo personalmente più convincente, ma (.) e::h in ogni caso, come dire (.) le due cose si vanno a completare abbastanza.	e: che trovo personalmente più convincente, ma {P} e::h in ogni caso, come dire {P} le due cose si vanno a completare abbastanza.	e che trovo personalmente più convincente ma {P} eh in ogni caso come dire {P} le due cose si vanno a completare abbastanza
203	BO100	1370.375	1385.085	14.71	True	False	0	0	0	0	0	0	0	0	False	False	False	False	False	_	False	2	0	0	36	e:: sono quasi due::  due poli. di un ennesimo continuum dove troviamo da un lato (.) un' idea di continuità mediale molto forte, e dall' altro lo vedremo lo vediamo (.) adesso, e:: un' idea di rivoluzione digitale.	e:: sono quasi due:: due poli. di un ennesimo continuum dove troviamo da un lato {P} un' idea di continuità mediale molto forte, e dall' altro lo vedremo lo vediamo {P} adesso, e:: un' idea di rivoluzione digitale.	e sono quasi due due poli di un ennesimo continuum dove troviamo da un lato {P} un' idea di continuità mediale molto forte e dall' altro lo vedremo lo vediamo {P} adesso e un' idea di rivoluzione digitale
204	BO100	1385.705	1397.646	11.941	True	False	0	0	1	0	0	0	0	0	False	False	False	False	False	_	False	2	0	0	36	io diffido sempre abbastanza da chi parla l' avrete già capito (.) dalle: dalle mie varie lezioni, di rivoluzione, perchè, tutti parlano di rivoluzione e poi ci si accorge che non era così tanto (.) rivoluzionaria quella rivoluzione	io diffido sempre abbastanza da chi parla l' avrete già capito {P} dalle: dalle mie varie lezioni, di rivoluzione, perché, tutti parlano di rivoluzione e poi ci si accorge che non era così tanto {P} rivoluzionaria quella rivoluzione	io diffido sempre abbastanza da chi parla l' avrete già capito {P} dalle dalle mie varie lezioni di rivoluzione perché tutti parlano di rivoluzione e poi ci si accorge che non era così tanto {P} rivoluzionaria quella rivoluzione
205	BO100	1397.831	1405.385	7.554	True	False	0	0	0	0	1	0	0	0	False	False	False	False	False	_	False	2	0	0	14	e: pero comunque (.) e::m: (.) questo non toglie che quello che ci dice manovic, e:: (.)	e: pero comunque {P} e::m: {P} questo non toglie che quello che ci dice manovic, e::	e pero comunque {P} em {P} questo non toglie che quello che ci dice manovic e
206	BO100	1406.616	1410.44	3.824	True	False	0	0	0	0	0	0	0	0	False	False	False	False	False	_	False	1	0	0	7	costituisce (.) un punto di vista ugualmente interessante.	costituisce {P} un punto di vista ugualmente interessante.	costituisce {P} un punto di vista ugualmente interessante
207	BO100	1410.753	1418.597	7.844	True	False	0	0	0	0	0	0	0	0	False	False	False	False	False	_	False	0	0	0	21	ripeto ognuno di voi poi si farà la sua idea rispetto al condividerne o no, determinati presupposti e soprattutto determinate applicazioni.	ripeto ognuno di voi poi si farà la sua idea rispetto al condividerne o no, determinati presupposti e soprattutto determinate applicazioni.	ripeto ognuno di voi poi si farà la sua idea rispetto al condividerne o no determinati presupposti e soprattutto determinate applicazioni
208	BO100	1419.669	1424.851	5.182	True	False	0	0	0	0	0	0	0	0	False	False	False	False	False	_	False	2	0	0	13	ciò non toglie che sia (.) un tassello importante nel pensiero (.) sull' estetica digitale.	ciò non toglie che sia {P} un tassello importante nel pensiero {P} sull' estetica digitale.	ciò non toglie che sia {P} un tassello importante nel pensiero {P} sull' estetica digitale
209	BO100	1425.25	1430.027	4.777	True	False	0	0	0	0	0	0	0	0	False	False	False	False	False	_	False	2	0	0	14	e come tale ha senso che ci soffermiamo (.) almeno: (.) qualche minuto, a parlarne, e	e come tale ha senso che ci soffermiamo {P} almeno: {P} qualche minuto, a parlarne, e	e come tale ha senso che ci soffermiamo {P} almeno {P} qualche minuto a parlarne e
210	BO100	1430.713	1434.04	3.327	True	False	0	0	0	0	0	0	0	0	False	False	False	False	False	_	False	1	0	0	10	è giusto (.) che ne leggiate almeno alcuni brani alcune pagine.	è giusto {P} che ne leggiate almeno alcuni brani alcune pagine.	è giusto {P} che ne leggiate almeno alcuni brani alcune pagine
211	BO100	1435.151	1439.027	3.876	True	False	0	0	0	0	0	0	0	0	False	False	False	False	False	_	False	1	0	0	10	quello che dice manovic, è che (.) con i media digitali,	quello che dice manovic, è che {P} con i media digitali,	quello che dice manovic è che {P} con i media digitali
212	BO100	1441.49	1444.641	3.151	True	False	0	0	0	0	0	0	0	0	False	False	False	False	False	_	False	0	0	0	9	non è tanto importante quello che succede sulla superficie,	non è tanto importante quello che succede sulla superficie,	non è tanto importante quello che succede sulla superficie
213	BO100	1445.666	1448.635	2.969	True	False	0	0	0	0	0	0	0	0	False	False	False	False	False	_	False	0	0	0	8	non è tanto importante quello che noi vediamo,	non è tanto importante quello che noi vediamo,	non è tanto importante quello che noi vediamo
214	BO100	1449.548	1455.346	5.798	True	False	0	0	0	0	0	0	0	0	False	False	False	False	False	_	False	1	0	0	12	non sono tanto importanti le interfacce, le strutture, gli applicativi, (.) i siti,	non sono tanto importanti le interfacce, le strutture, gli applicativi, {P} i siti,	non sono tanto importanti le interfacce le strutture gli applicativi {P} i siti
215	BO100	1455.931	1459.276	3.345	True	False	0	0	0	0	0	0	0	0	False	False	False	False	False	_	False	0	0	0	11	che noi andiamo a navigare, con i quali andiamo a interagire.	che noi andiamo a navigare, con i quali andiamo a interagire.	che noi andiamo a navigare con i quali andiamo a interagire
216	BO100	1459.591	1460.861	1.27	True	False	0	0	0	0	0	0	0	0	False	False	False	False	False	_	False	0	0	0	3	non è questo.	non è questo.	non è questo
217	BO100	1461.428	1464.085	2.657	True	False	0	0	0	0	0	0	0	0	False	False	False	False	False	_	False	1	0	0	4	il cambiamento (.) anche estetico,	il cambiamento {P} anche estetico,	il cambiamento {P} anche estetico
218	BO100	1464.636	1466.533	1.897	True	False	0	0	0	0	0	0	0	0	False	False	False	False	False	_	False	1	0	0	3	portato (.) dal digitale.	portato {P} dal digitale.	portato {P} dal digitale
219	BO100	1467.265	1468.396	1.131	True	False	0	0	0	0	0	0	0	0	False	False	False	False	False	_	False	0	0	0	3	dai media digitali.	dai media digitali.	dai media digitali
220	BO100	1468.901	1471.516	2.615	True	False	0	0	0	0	0	0	0	0	False	False	False	False	False	_	False	0	0	0	7	c' è un cambio di paradigma strutturale.	c' è un cambio di paradigma strutturale.	c' è un cambio di paradigma strutturale
221	BO100	1473.015	1475.505	2.49	True	False	0	0	0	0	0	0	0	0	False	False	False	False	False	_	False	1	0	0	6	che (.) arriva con i media digitali.	che {P} arriva con i media digitali.	che {P} arriva con i media digitali
222	BO100	1476.221	1481.133	4.912	True	False	0	0	0	0	0	0	0	0	False	False	False	False	False	_	False	0	0	0	13	e questo cambio di paradigma strutturale, ha delle conseguenze che sono anche estetiche.	e questo cambio di paradigma strutturale, ha delle conseguenze che sono anche estetiche.	e questo cambio di paradigma strutturale ha delle conseguenze che sono anche estetiche
223	BO100	1482.406	1484.935	2.529	True	False	0	0	0	0	0	0	0	0	False	False	False	False	False	_	False	0	0	0	8	ma non a livello superficiale. a livello profondo.	ma non a livello superficiale. a livello profondo.	ma non a livello superficiale a livello profondo
224	BO100	1486.605	1493.505	6.9	True	False	0	0	0	0	0	0	0	0	False	False	False	False	False	_	False	3	0	0	12	con i media digitali, (.) cambia in maniera radicale, l' organizzazione (.) delle (.) informazioni.	con i media digitali, {P} cambia in maniera radicale, l' organizzazione {P} delle {P} informazioni.	con i media digitali {P} cambia in maniera radicale l' organizzazione {P} delle {P} informazioni
225	BO100	1494.02	1500.921	6.901	True	False	0	0	0	0	0	0	0	0	False	False	False	False	False	_	False	0	0	0	18	la struttura l' avremmo l' abbiamo chiamata, pochi minuti fa o la setimana scorsa, l' architettura dell' informazione.	la struttura l' avremmo l' abbiamo chiamata, pochi minuti fa o la setimana scorsa, l' architettura dell' informazione.	la struttura l' avremmo l' abbiamo chiamata pochi minuti fa o la setimana scorsa l' architettura dell' informazione
226	BO100	1501.53	1506.613	5.083	True	False	0	0	0	0	0	0	0	0	False	False	False	False	False	_	False	1	0	0	10	il modo in cui le informazioni, vengono (.) raggruppate e organizzate.	il modo in cui le informazioni, vengono {P} raggruppate e organizzate.	il modo in cui le informazioni vengono {P} raggruppate e organizzate
227	BO100	1508.13	1510.168	2.038	True	False	0	0	0	0	0	0	0	0	False	False	False	False	False	_	False	0	0	0	4	anche nelle forme artistiche.	anche nelle forme artistiche.	anche nelle forme artistiche
228	BO100	1511.336	1521.423	10.087	True	False	0	0	0	0	0	0	0	0	False	False	False	False	False	_	False	3	0	0	17	anche (.) in quegli aspetti (.) simbolici, culturali (.) che inevitabilmente queste piattaforme hanno. che inevitabilmente questi spazi digitali hanno.	anche {P} in quegli aspetti {P} simbolici, culturali {P} che inevitabilmente queste piattaforme hanno. che inevitabilmente questi spazi digitali hanno.	anche {P} in quegli aspetti {P} simbolici culturali {P} che inevitabilmente queste piattaforme hanno che inevitabilmente questi spazi digitali hanno
229	BO100	1522.831	1531.126	8.295	True	False	0	0	0	0	0	0	0	0	False	False	False	False	False	_	False	1	0	0	14	il cambio (.) <dell' organizzazione alla base>, inevitabilmente influenza anche la rappresentazione  di questa informazione.	il cambio {P} <dell' organizzazione alla base>, inevitabilmente influenza anche la rappresentazione di questa informazione.	il cambio {P} dell' organizzazione alla base inevitabilmente influenza anche la rappresentazione di questa informazione
230	BO100	1531.846	1534.318	2.472	True	False	0	0	0	0	0	0	0	0	False	False	False	False	False	_	False	0	0	0	7	e quindi un piano estetico più tradizionale.	e quindi un piano estetico più tradizionale.	e quindi un piano estetico più tradizionale
231	BO100	1541.025	1548.345	7.32	True	False	0	0	0	0	0	0	0	0	False	False	False	False	False	_	False	2	0	0	7	manovic (.) propone come modello (.) dell' estetica digitale,	manovic {P} propone come modello {P} dell' estetica digitale,	manovic {P} propone come modello {P} dell' estetica digitale
232	BO100	1549.503	1551.928	2.425	True	False	0	0	0	0	0	0	0	0	False	False	False	False	False	_	False	0	0	0	8	quella che lui chiama la logica del database.	quella che lui chiama la logica del database.	quella che lui chiama la logica del database
233	BO100	1553.488	1562.005	8.517	True	False	0	0	0	0	0	0	0	0	False	False	False	False	False	_	False	1	0	0	14	l' oganizzazione dell' informazione negli spazi digitali, non avviene (.) nel modo classico e lineare,	l' oganizzazione dell' informazione negli spazi digitali, non avviene {P} nel modo classico e lineare,	l' oganizzazione dell' informazione negli spazi digitali non avviene {P} nel modo classico e lineare
234	BO100	1562.56	1564.391	1.831	True	False	0	0	0	0	0	0	0	0	False	False	False	False	False	_	False	0	0	0	4	a cui eravamo abituati,	a cui eravamo abituati,	a cui eravamo abituati
235	BO100	1566.074	1569.023	2.949	True	False	0	0	0	0	0	0	0	0	False	False	False	False	False	_	False	1	0	0	9	a cui secondo me (.) in parte siamo ancora abituati,	a cui secondo me {P} in parte siamo ancora abituati,	a cui secondo me {P} in parte siamo ancora abituati
236	BO100	1570.735	1573.6	2.865	True	False	0	0	0	0	0	0	0	0	False	False	False	False	False	_	False	0	0	0	6	ma avviene, in una forma diversa.	ma avviene, in una forma diversa.	ma avviene in una forma diversa
237	BO100	1575.191	1577.783	2.592	True	False	0	0	0	0	0	0	0	0	False	False	False	False	False	_	False	1	0	0	7	da un lato c' è (.) la narrazione.	da un lato c' è {P} la narrazione.	da un lato c' è {P} la narrazione
238	BO100	1578.856	1581.328	2.472	True	False	0	0	0	0	0	0	0	0	False	False	False	False	False	_	False	1	0	0	6	dall' altro c' è (.) il database.	dall' altro c' è {P} il database.	dall' altro c' è {P} il database
239	BO100	1583.505	1585.103	1.598	True	False	0	0	0	0	0	0	0	0	False	False	False	False	False	_	False	0	0	0	2	la narrazione,	la narrazione,	la narrazione
240	BO100	1585.785	1587.376	1.591	True	False	0	0	0	0	0	0	0	0	False	False	False	False	False	_	False	0	0	0	5	mette in fila le cose.	mette in fila le cose.	mette in fila le cose
241	BO100	1588.258	1592.36	4.102	True	False	0	0	0	0	0	0	0	0	False	False	False	False	False	_	False	0	0	0	8	le articola secondo un ordine. in una sequenza.	le articola secondo un ordine. in una sequenza.	le articola secondo un ordine in una sequenza
242	BO100	1593.288	1596.065	2.777	True	False	0	0	0	0	0	0	0	0	False	False	False	False	False	_	False	0	0	0	11	succede prima una cosa, poi un' altra poi un' altra ancora.	succede prima una cosa, poi un' altra poi un' altra ancora.	succede prima una cosa poi un' altra poi un' altra ancora
243	BO100	1596.48	1603.96	7.48	True	False	0	0	0	0	0	0	0	0	False	False	False	False	False	_	False	2	0	0	21	anche nel momento in cui il racconto mi racconta questi elementi (.) in una sequenza diversa, vabbè (.) fabula intreccio lo sapete. spero.	anche nel momento in cui il racconto mi racconta questi elementi {P} in una sequenza diversa, vabbè {P} fabula intreccio lo sapete. spero.	anche nel momento in cui il racconto mi racconta questi elementi {P} in una sequenza diversa vabbè {P} fabula intreccio lo sapete spero
244	BO100	1606.803	1612.498	5.695	True	False	0	0	0	0	0	0	0	0	False	False	False	False	False	_	False	0	0	0	12	la narrazione tradizionale, ha un inizio. la narrazione tradizionale, ha una fine.	la narrazione tradizionale, ha un inizio. la narrazione tradizionale, ha una fine.	la narrazione tradizionale ha un inizio la narrazione tradizionale ha una fine
245	BO100	1612.72	1618.72	6.0	True	False	0	0	0	0	0	0	0	0	False	False	False	False	False	_	False	0	0	0	18	ha un momento in cui comincia, ha uno sviluppo, ha una durata, ha un ritmo, ha una conclusione.	ha un momento in cui comincia, ha uno sviluppo, ha una durata, ha un ritmo, ha una conclusione.	ha un momento in cui comincia ha uno sviluppo ha una durata ha un ritmo ha una conclusione
246	BO100	1623.603	1628.076	4.473	True	False	0	0	0	0	0	0	0	0	False	False	False	False	False	_	False	0	0	0	9	secondo manovic, il database, funziona in maniera completamente diversa.	secondo manovic, il database, funziona in maniera completamente diversa.	secondo manovic il database funziona in maniera completamente diversa
247	BO100	1629.168	1632.931	3.763	True	False	0	0	1	0	0	0	0	0	False	False	False	False	False	_	False	2	0	0	8	perchè mina alla base i presupposti (.) della (.) narrazione.	perché mina alla base i presupposti {P} della {P} narrazione.	perché mina alla base i presupposti {P} della {P} narrazione
248	BO100	1633.955	1643.356	9.401	True	False	0	0	0	0	0	0	0	0	False	False	False	False	False	_	False	0	0	0	22	le informazioni, su internet, negli spazi digitali, nel videogioco, che è un altro degli esempi che manovic, e:h utilizza con ampia frequenza,	le informazioni, su internet, negli spazi digitali, nel videogioco, che è un altro degli esempi che manovic, e:h utilizza con ampia frequenza,	le informazioni su internet negli spazi digitali nel videogioco che è un altro degli esempi che manovic eh utilizza con ampia frequenza
249	BO100	1645.243	1650.428	5.185	True	False	0	0	0	0	0	0	0	0	False	False	False	False	False	_	False	0	0	0	12	in tutti questi casi, non c' è, una chiara progressione delle sequenze.	in tutti questi casi, non c' è, una chiara progressione delle sequenze.	in tutti questi casi non c' è una chiara progressione delle sequenze
250	BO100	1651.165	1654.095	2.93	True	False	0	0	0	0	0	0	0	0	False	False	False	False	False	_	False	0	0	0	7	non abbiamo una linea. abbiamo un reticolo.	non abbiamo una linea. abbiamo un reticolo.	non abbiamo una linea abbiamo un reticolo
251	BO100	1655.255	1660.663	5.408	True	False	0	0	0	0	0	0	0	0	False	False	False	False	False	_	False	1	0	0	16	abbiamo (.) in ogni ta~ in ogni passaggio un insieme di possibilità. pensate alle azioni del videogioco.	abbiamo {P} in ogni ta~ in ogni passaggio un insieme di possibilità. pensate alle azioni del videogioco.	abbiamo {P} in ogni ta~ in ogni passaggio un insieme di possibilità pensate alle azioni del videogioco
252	BO100	1661.035	1668.436	7.401	True	False	0	0	0	0	0	0	0	0	False	False	False	False	False	_	False	0	0	0	25	che chiaramente, una volta che faccio qualcosa, mi portano da qualche parte mentre potrebbero portarmi anche da qualche altra parte se avessi fatto qualcos' altro.	che chiaramente, una volta che faccio qualcosa, mi portano da qualche parte mentre potrebbero portarmi anche da qualche altra parte se avessi fatto qualcos' altro.	che chiaramente una volta che faccio qualcosa mi portano da qualche parte mentre potrebbero portarmi anche da qualche altra parte se avessi fatto qualcos' altro
253	BO100	1672.788	1677.756	4.968	True	False	0	0	0	0	0	0	0	0	False	False	False	False	False	_	False	0	0	0	16	l' organizzazione dei dati all' interno di una base di dati, all' interno di un database,	l' organizzazione dei dati all' interno di una base di dati, all' interno di un database,	l' organizzazione dei dati all' interno di una base di dati all' interno di un database
254	BO100	1678.211	1679.981	1.77	True	False	0	0	0	0	0	0	0	0	False	False	False	False	False	_	False	0	0	0	4	è un' organizzazione, che:	è un' organizzazione, che:	è un' organizzazione che
255	BO100	1681.817	1684.533	2.716	True	False	0	0	0	0	0	0	0	0	False	False	False	False	False	_	False	0	0	0	7	non presenta un solo modo di accedervi,	non presenta un solo modo di accedervi,	non presenta un solo modo di accedervi
256	BO100	1686.083	1689.036	2.953	True	False	0	0	0	0	0	0	0	0	False	False	False	False	False	_	False	0	0	0	3	ipotizzate::, per assurdo,	ipotizzate::, per assurdo,	ipotizzate per assurdo
257	BO100	1689.461	1691.85	2.389	True	False	0	0	0	0	0	0	0	0	False	False	False	False	False	_	False	0	0	0	7	mettere i~ di mettere in ordine google.	mettere i~ di mettere in ordine google.	mettere i~ di mettere in ordine google
258	BO100	1692.82	1696.156	3.336	True	False	0	0	0	0	0	0	0	0	False	False	False	False	False	_	False	0	0	0	13	di mettere in ordine le cose a cui google vi consente di accedere.	di mettere in ordine le cose a cui google vi consente di accedere.	di mettere in ordine le cose a cui google vi consente di accedere
259	BO100	1696.635	1700.578	3.943	True	False	0	0	0	0	0	0	0	0	False	False	False	False	False	_	False	0	0	0	9	l' abbiamo visto parlando di storia. dei media digitali.	l' abbiamo visto parlando di storia. dei media digitali.	l' abbiamo visto parlando di storia dei media digitali
